[{"code":"N","name":"No Data","pretty":"No Data","traffic":"no-data"},{"code":"M","name":"Minimal Traffic","pretty":"Minimal Traffic","traffic":"minimal-traffic"},{"code":"M","name":"Medium Traffic","pretty":"Medium Traffic","traffic":"medium-traffic"},{"code":"H","name":"High Traffic","pretty":"High Traffic","traffic":"high-traffic"}]